{
  "artifact_version": "gate3.authority-observation-bundle.v1",
  "bundle_id": "BUNDLE-G3-USER-008-AUTHORITY-REPAIR-V1",
  "episode_id": "G3-USER-008",
  "source_authority_id": "FIXTURE-WAJE-RUN-EVIDENCE-REPAIR-V1",
  "schedule_id": "SCHEDULE-G3-AUTHORITY-REPAIR-V1",
  "fixture_ref": "fixture://wajegame/run-evidence-repair/v1",
  "gate_contract": {
    "gate_stage": "G3",
    "authority_state": "provisional",
    "answer_status": "provisional",
    "workflow_state": "provisional",
    "delivery_state": "withheld",
    "disposition_scope": "claim"
  },
  "accepted_authority": {
    "case_ref": "case:g3-user-008-prior",
    "analysis_cycle_ref": "cycle:g3-user-008-cycle-1",
    "question_revision_ref": "question:qrev-g3-user-008-1",
    "frame_revision_ref": "frame:frev-g3-user-008-1",
    "plan_revision_ref": "plan:prev-g3-user-008-1"
  },
  "observations": [
    {
      "observation_id": "OBS-G3-USER-008-01",
      "sequence": 1,
      "milestone_id": "MS-G3-01-INGRESS",
      "kind": "ingress_received",
      "occurred_at": "2026-06-03T09:30:30+01:00",
      "observed_at": "2026-06-03T09:30:30+01:00",
      "run_attempt_ref": "run:g3-user-008-attempt-1",
      "causation_observation_ids": [],
      "authority_refs": [
        "case:g3-user-008-prior",
        "question:qrev-g3-user-008-1"
      ],
      "claim_refs": [
        "claim:paid-amount-growth",
        "claim:channel-a-largest-increment"
      ],
      "admission_decision": "admitted",
      "event_identity": {
        "source_event_ref": "event:ingress-g3-user-008-1",
        "idempotency_key": "g3-user-008-ingress-1",
        "payload_sha256": "783ccdb9c75c9d01336ea3cd31ca878480a3c250066d765fac469d27c601e807",
        "payload": {
          "business_facts": [
            "The user asks whether quality defects overturn the prior total and channel claims."
          ],
          "idempotency_key": "g3-user-008-ingress-1"
        }
      },
      "authority_effect": {
        "effect_kind": "ingress_anchored",
        "appended_object_refs": [
          "ingress:g3-user-008-1"
        ],
        "invalidated_object_refs": [],
        "superseded_object_refs": [],
        "note": "The challenge request is anchored to the prior case and its two business claims."
      },
      "details": {
        "business_facts": [
          "The user asks whether quality defects overturn the prior total and channel claims."
        ],
        "boundary_codes": []
      }
    },
    {
      "observation_id": "OBS-G3-USER-008-02",
      "sequence": 2,
      "milestone_id": "MS-G3-02-FRAME-ACCEPT",
      "kind": "frame_accepted",
      "occurred_at": "2026-06-03T08:31:10+01:00",
      "observed_at": "2026-06-03T09:31:10+01:00",
      "run_attempt_ref": "run:g3-user-008-attempt-1",
      "causation_observation_ids": [
        "OBS-G3-USER-008-01"
      ],
      "authority_refs": [
        "question:qrev-g3-user-008-1",
        "frame:frev-g3-user-008-1"
      ],
      "claim_refs": [
        "claim:paid-amount-growth",
        "claim:channel-a-largest-increment"
      ],
      "admission_decision": "admitted",
      "event_identity": {
        "source_event_ref": "event:frame-accepted-g3-user-008-1",
        "idempotency_key": "g3-user-008-frame-accept-1",
        "payload_sha256": "7cd5e070a4900ac0c9938ec77003930e01044e7fc14c9e823e4d9ebda61461a3",
        "payload": {
          "business_facts": [
            "The correction uses the existing observation unit and deduplication contract."
          ],
          "idempotency_key": "g3-user-008-frame-accept-1"
        }
      },
      "authority_effect": {
        "effect_kind": "accepted_revision_advanced",
        "appended_object_refs": [
          "frame:frev-g3-user-008-1"
        ],
        "invalidated_object_refs": [],
        "superseded_object_refs": [],
        "note": "The canonical-payment-order frame is accepted for this cycle."
      },
      "details": {
        "business_facts": [
          "The correction uses the existing observation unit and deduplication contract."
        ],
        "boundary_codes": []
      }
    },
    {
      "observation_id": "OBS-G3-USER-008-03",
      "sequence": 3,
      "milestone_id": "MS-G3-03-PLAN-ACCEPT",
      "kind": "plan_accepted",
      "occurred_at": "2026-06-03T08:31:20+01:00",
      "observed_at": "2026-06-03T09:31:20+01:00",
      "run_attempt_ref": "run:g3-user-008-attempt-1",
      "causation_observation_ids": [
        "OBS-G3-USER-008-02"
      ],
      "authority_refs": [
        "frame:frev-g3-user-008-1",
        "plan:prev-g3-user-008-1"
      ],
      "claim_refs": [
        "claim:paid-amount-growth",
        "claim:channel-a-largest-increment"
      ],
      "admission_decision": "admitted",
      "event_identity": {
        "source_event_ref": "event:plan-accepted-g3-user-008-1",
        "idempotency_key": "g3-user-008-plan-accept-1",
        "payload_sha256": "982f0803e87131239015e34ee1040a43723b88b6b4a06382ad3dba06bef3216a",
        "payload": {
          "business_facts": [
            "Both tasks use the same accepted frame and release."
          ],
          "idempotency_key": "g3-user-008-plan-accept-1"
        }
      },
      "authority_effect": {
        "effect_kind": "accepted_revision_advanced",
        "appended_object_refs": [
          "plan:prev-g3-user-008-1"
        ],
        "invalidated_object_refs": [],
        "superseded_object_refs": [],
        "note": "The accepted plan binds total recomputation and channel sensitivity tasks."
      },
      "details": {
        "business_facts": [
          "Both tasks use the same accepted frame and release."
        ],
        "boundary_codes": []
      }
    },
    {
      "observation_id": "OBS-G3-USER-008-04",
      "sequence": 4,
      "milestone_id": "MS-G3-04-INITIAL-EFFECT",
      "kind": "effect_recorded",
      "occurred_at": "2026-06-03T08:33:00+01:00",
      "observed_at": "2026-06-03T09:33:00+01:00",
      "run_attempt_ref": "run:g3-user-008-attempt-1",
      "causation_observation_ids": [
        "OBS-G3-USER-008-03"
      ],
      "authority_refs": [
        "plan:prev-g3-user-008-1",
        "query:qspec-g3-user-008-initial-1",
        "result:result-g3-user-008-initial-1",
        "snapshot:paid-success-20260602-release-0930"
      ],
      "claim_refs": [
        "claim:paid-amount-growth",
        "claim:channel-a-largest-increment"
      ],
      "admission_decision": "admitted",
      "event_identity": {
        "source_event_ref": "event:initial-effect-g3-user-008-1",
        "idempotency_key": "g3-user-008-initial-effect-1",
        "payload_sha256": "c0eefb1214ca4355119f84ae55e90ff19b63c0491d3aa94f3c4b58b2f567be4c",
        "payload": {
          "business_facts": [
            "The unrepaired effect reports 30 percent growth and Channel A first."
          ],
          "idempotency_key": "g3-user-008-initial-effect-1"
        }
      },
      "authority_effect": {
        "effect_kind": "capability_effect_appended",
        "appended_object_refs": [
          "result:result-g3-user-008-initial-1"
        ],
        "invalidated_object_refs": [],
        "superseded_object_refs": [],
        "note": "The initial result records NGN 1300 target amount against NGN 1000 baseline."
      },
      "details": {
        "business_facts": [
          "The unrepaired effect reports 30 percent growth and Channel A first."
        ],
        "boundary_codes": []
      }
    },
    {
      "observation_id": "OBS-G3-USER-008-05",
      "sequence": 5,
      "milestone_id": "MS-G3-05-INITIAL-EVIDENCE",
      "kind": "evidence_admitted",
      "occurred_at": "2026-06-03T08:34:10+01:00",
      "observed_at": "2026-06-03T09:34:10+01:00",
      "run_attempt_ref": "run:g3-user-008-attempt-1",
      "causation_observation_ids": [
        "OBS-G3-USER-008-04"
      ],
      "authority_refs": [
        "evidence:evidence-g3-user-008-total-1",
        "evidence:evidence-g3-user-008-channel-1",
        "result:result-g3-user-008-initial-1"
      ],
      "claim_refs": [
        "claim:paid-amount-growth",
        "claim:channel-a-largest-increment"
      ],
      "admission_decision": "admitted",
      "event_identity": {
        "source_event_ref": "event:initial-evidence-g3-user-008-1",
        "idempotency_key": "g3-user-008-initial-evidence-1",
        "payload_sha256": "0b7a2fd24ba89a67e52840b38a67d9e424535ddbcd58c104a2a8345fdd6f8f82",
        "payload": {
          "business_facts": [
            "Each evidence record binds the accepted frame, plan, query, result and release."
          ],
          "idempotency_key": "g3-user-008-initial-evidence-1"
        }
      },
      "authority_effect": {
        "effect_kind": "evidence_record_appended",
        "appended_object_refs": [
          "evidence:evidence-g3-user-008-total-1",
          "evidence:evidence-g3-user-008-channel-1"
        ],
        "invalidated_object_refs": [],
        "superseded_object_refs": [],
        "note": "Initial total and channel evidence records are admitted as immutable objects."
      },
      "details": {
        "business_facts": [
          "Each evidence record binds the accepted frame, plan, query, result and release."
        ],
        "boundary_codes": []
      }
    },
    {
      "observation_id": "OBS-G3-USER-008-06",
      "sequence": 6,
      "milestone_id": "MS-G3-06-INITIAL-REVIEW",
      "kind": "review_recorded",
      "occurred_at": "2026-06-03T08:34:30+01:00",
      "observed_at": "2026-06-03T09:34:30+01:00",
      "run_attempt_ref": "run:g3-user-008-attempt-1",
      "causation_observation_ids": [
        "OBS-G3-USER-008-05"
      ],
      "authority_refs": [
        "evidence:evidence-g3-user-008-total-1",
        "evidence:evidence-g3-user-008-channel-1"
      ],
      "claim_refs": [
        "claim:paid-amount-growth",
        "claim:channel-a-largest-increment"
      ],
      "admission_decision": "admitted",
      "event_identity": {